{
  "original_tokens": 100,
  "compressed_tokens": 80,
  "cost_savings_estimate": 0.05,
  "compression_suggestions": [
    {
      "original_text": "Please provide a summary of the following text:",
      "suggested_text": "Summarize:",
      "reason": "Removes unnecessary conversational filler."
    }
  ]
}
